{
  "type": "answer",
  "id": "a-0009",
  "stream": "visualization-tools-putnam",
  "text": "Open: judge reliability is not yet established. The audit harness and stratified samples exist (target Cohen's kappa >= 0.6), but human grading and the kappa computation have not been completed, so the studies' reliance on a single LLM judge is not yet validated.",
  "status": "inconclusive",
  "answers": [
    "q-0009"
  ],
  "backed_by": [
    "e-0009"
  ],
  "edge_comments": {},
  "provenance": {
    "created_by": "claude",
    "created_at": "2026-06-11T03:07:07.084Z",
    "updated_at": "2026-06-11T03:07:07.084Z"
  },
  "comments": {}
}
