{
  "type": "answer",
  "id": "a-0008",
  "stream": "slitherlink-tool-granularity",
  "text": "The meta-tools axis is dropped. The early \"meta is inert\" finding was confounded (the meta server was never configured) and is withdrawn; once configured, the only puzzle where scratchpad's clean bail makes meta affordable is exactly the one whose meta-nudge suppresses that bail, so no fair cost-bounded test exists on subscription compute. Footnote/appendix only.",
  "status": "refuted",
  "answers": [
    "q-0008"
  ],
  "backed_by": [
    "e-0008"
  ],
  "edge_comments": {},
  "provenance": {
    "created_by": "claude",
    "created_at": "2026-06-03T03:47:42.041Z",
    "updated_at": "2026-06-03T03:47:42.041Z",
    "source_ref": {
      "repo": "claude-sudoku-experiments",
      "commit": "0e31a015d8dab3348b6f48fdca81191e4ff97aa6"
    }
  },
  "comments": {}
}
